Heady aromas of white rose and apricot practically jump out of the glass. Dry and linear, the crisp palate offers unripe yellow peach and lemon zest alongside a note of crushed Mediterranean herb. Brisk acidity gives it a vibrant edge. KERIN O’KEEFE;87;Gorghi Tondi 2018 Rajah Biologico Zibibbo (Sicilia);$24;Rajah Biologico;Zibibbo, Muscat;Sicilia, Sicily & Sardinia, Italy;Gorghi Tondi;KERIN O’KEEFE;13%;750 ml;White;Sheehan Brothers;3/1/2020
The rather subdued nose has aromas of yellow stone fruit and a hint of hazelnut. The aromas carry over to the palate along with white almond, a hint of peach and tangy acidity. KERIN O’KEEFE;87;Nuraghe Crabioni 2018 Kanimar (Vermentino di Sardegna);$25;Kanimar;Vermentino, Italian White;Vermentino di Sardegna, Sicily & Sardinia, Italy;Nuraghe Crabioni;KERIN O’KEEFE;13.5%;750 ml;White;Vias Imports;3/1/2020
This deeply hued wine has aromas of acacia honey, dried apricot and grilled Mediterranean herb. The linear, lean palate offers lemon drop, pineapple and honeyed notes before a bitter walnut close. KERIN O’KEEFE;87;San Bartolo 2016 White (Terre Siciliane);N/A;;White Blend;Terre Siciliane, Sicily & Sardinia, Italy;San Bartolo;KERIN O’KEEFE;11.5%;750 ml;White;1_No Submitting Co;3/1/2020
Aromas of fragrant spring flower and exotic fruit make their way front and center. The crisp palate offers pineapple, honeydew melon and lemon zest alongside brisk acidity. KERIN O’KEEFE;87;Tenuta Marchisio 2018 Falanghina (Campania);$15;;Falanghina, Italian White;Campania, Southern Italy, Italy;Tenuta Marchisio;KERIN O’KEEFE;13.5%;750 ml;White;Siena Imports;3/1/2020
A blend of Fiano, Moscato and Falanghina, this has aromas of yellow stone fruit, citrus and Mediterranean brush. The aromas carry on to the bright palate alongside crisp acidity. KERIN O’KEEFE;87;Casa di Baal 2018 White (Colli di Salerno);N/A;;White Blend;Colli di Salerno, Southern Italy, Italy;Casa di Baal;KERIN O’KEEFE;12%;750 ml;White;Mucci Imports;3/1/2020
Fragrant spring flower and exotic fruit aromas lead the nose. On the rounded, fruity palate, tangy acidity accompanies banana, pineapple and honeydew melon. KERIN O’KEEFE;87;F.lli Puddu 2018 Gioas Su Sole White (Isola dei Nuraghi);$22;Gioas Su Sole;White Blend;Isola dei Nuraghi, Sicily & Sardinia, Italy;F.lli Puddu;KERIN O’KEEFE;13%;750 ml;White;Enotria Wine Import;3/1/2020
Aromas of leather, camphor and underbrush follow over to the palate together with notes of salted game and dried cherry. Firm acidity and tight close-grained tannins leave an austere, rather astringent finish. KERIN O’KEEFE;87;Il Chiosso 2016 Fara;$28;;Nebbiolo;Fara, Piedmont, Italy;Il Chiosso;KERIN O’KEEFE;13%;750 ml;Red;Vias Imports;3/1/2020
This Frappato has aromas of candied berry and white pepper. The aromas carry over to the light-bodied palate along with soft tannins. Drink soon. KERIN O’KEEFE;87;Tenuta Bastonaca 2017 Frappato (Terre Siciliane);$22;;Frappato, Italian Red;Terre Siciliane, Sicily & Sardinia, Italy;Tenuta Bastonaca;KERIN O’KEEFE;12.5%;750 ml;Red;Florio Imports;3/1/2020
This has an extremely shy nose that eventually reveals subtle whiffs of Spanish broom and ripe white stone fruit. The round palate is also understated and subdued, offering delicate notes suggesting mature yellow apple, bitter almond a honeyed note. KERIN O’KEEFE;87;Cantine Olivella 2017 Lacrimabianco White (Lacryma Christi del Vesuvio);$19;Lacrimabianco;White Blend;Lacryma Christi del Vesuvio, Southern Italy, Italy;Cantine Olivella;KERIN O’KEEFE;13%;750 ml;White;Panebianco;3/1/2020
Aromas suggesting spring blossom, mature yellow pear and grilled herb shape the nose. The aromas carry over to the rounded, rather evolved palate along with notes of citrus zest and a hint of tangy saline. KERIN O’KEEFE;87;Claudio Quarta 2017 Greco di Tufo;$23;;Greco, Italian White;Greco di Tufo, Southern Italy, Italy;Claudio Quarta;KERIN O’KEEFE;13.5%;750 ml;White;Enotec Imports, Inc;3/1/2020
Made with organically farmed Nero d'Avola and Frappato grapes, this opens with aromas of dark-skinned berry and cooking spice. The supple palate offers blackberry jam, toast and mocha. Drink through 2021. KERIN O’KEEFE;87;Cortese 2017 Classico Sabuci (Cerasuolo di Vittoria);$25;Classico Sabuci;Red Blends, Red Blends;Cerasuolo di Vittoria, Sicily & Sardinia, Italy;Cortese;KERIN O’KEEFE;13.5%;750 ml;Red;Saranty Imports;3/1/2020
Red berry, vineyard dust and a whiff of carob shape the nose. On the enjoyable palate, orange zest and saline accompany blueberry jam and lemon thyme alongside tangy acidity. KERIN O’KEEFE;87;Curto 2018 Rosato EOS Nero d'Avola (Eloro);$13;Rosato EOS;Nero d'Avola, Italian Red;Eloro, Sicily & Sardinia, Italy;Curto;KERIN O’KEEFE;12%;750 ml;Red;Premium Brands;3/1/2020
Made with organically grown Nero d'Avola, this opens with aromas of roasted coffee bean, toasted oak and ripe dark-skinned berry. The assertive palate offers blackberry jam, mocha and toasted oak alongside close-grained tannins. KERIN O’KEEFE;87;Feudo di Santa Tresa 2016 Avulisi Nero d'Avola (Terre Siciliane);$30;Avulisi;Nero d'Avola, Italian Red;Terre Siciliane, Sicily & Sardinia, Italy;Feudo di Santa Tresa;KERIN O’KEEFE;13.5%;750 ml;Red;Vias Imports;3/1/2020
Savory and bright, this has delicate aromas suggesting white spring flower, tropical fruit and white stone fruit. The tangy, refreshing palate offers pear, honeydew melon and citrus alongside crisp acidity. KERIN O’KEEFE;87;Fina 2018 Kebrilla Grillo (Sicilia);$15;Kebrilla;Grillo, Italian White;Sicilia, Sicily & Sardinia, Italy;Fina;KERIN O’KEEFE;13%;750 ml;White;Solstars;3/1/2020
Subtle aromas suggesting tilled earth, leather and underbrush form the nose along with a whiff of eucalyptus. On the somewhat lean palate, you'll find truffle, prune and dried sage alongside brisk acidity and dusty, drying tannins that leave a rather drying finish. Drink sooner rather than later. KERIN O’KEEFE;87;Il Chiosso 2010 Ghemme;$30;;Red Blends, Red Blends;Ghemme, Piedmont, Italy;Il Chiosso;KERIN O’KEEFE;13%;750 ml;Red;Vias Imports;3/1/2020
Balsamic aromas of camphor, worn leather and dried rose lead the nose. On the straightforward palate, lithe tannins lightly support dried cherry, orange zest and a hint of anise. KERIN O’KEEFE;87;Il Chiosso 2011 Red (Colline Novaresi);$25;;Red Blends, Red Blends;Colline Novaresi, Piedmont, Italy;Il Chiosso;KERIN O’KEEFE;13%;750 ml;Red;Vias Imports;3/1/2020
Delicate scents suggesting field flower, white stone fruit and citrus slowly appear on this. It's racy and linear, offering Meyer lemon, pineapple and saline alongside racy acidity. KERIN O’KEEFE;87;La Guardiense 2018 Janare Greco (Sannio);$15;Janare;Greco, Italian White;Sannio, Southern Italy, Italy;La Guardiense;KERIN O’KEEFE;13.5%;750 ml;White;Monsieur Touton Selection Ltd;3/1/2020
The shy nose slowly reveals Mediterranean scrub, citrus and a whiff of Spanish broom. The aromas give way to the linear palate offering sour cherry, citrus and a fennel note alongside fresh acidity. KERIN O’KEEFE;87;Palmento Costanzo 2018 Mofete Rosato (Etna);N/A;Mofete;Rosato, Rosé;Etna, Sicily & Sardinia, Italy;Palmento Costanzo;KERIN O’KEEFE;12.5%;750 ml;Rose;Artisanal Cellars;3/1/2020
Aromas of yellow peach and pineapple carry over to the bright, racy palate along with a note of white almond. Vibrant acidity gives it a crisp, clean close. KERIN O’KEEFE;87;Tenuta Cavalier Pepe 2018 Bianco di Bellonona Coda di Volpe (Irpinia);$15;Bianco di Bellonona;Coda di Volpe, Italian White;Irpinia, Southern Italy, Italy;Tenuta Cavalier Pepe;KERIN O’KEEFE;13%;750 ml;White;Alberello Imports;3/1/2020
Intense aromas of orange blossom and pressed flower evoking room freshener jump out of the glass. On the syrupy, rather one-dimensional palate, you'll honey and candied notes. KERIN O’KEEFE;87;Colosi 2015 Passito Na'jm Malvar (Salina);N/A;Passito Na'jm;Malvar, Spanish White;Salina, Sicily & Sardinia, Italy;Colosi;KERIN O’KEEFE;13%;750 ml;Dessert;Vias Imports;3/1/2020
Made with organically grown Nero d'Avola grapes, this has aromas of dark-skinned berry, Mediterranean brush and baking spice. The easygoing, light-bodied palate offers blackberry jam, star anise and a touch of white pepper alongside smooth tannins. Drink soon. KERIN O’KEEFE;87;Gorghi Tondi 2018 Luce di Luna Nero d'Avola (Sicilia);$14;Luce di Luna;Nero d'Avola, Italian Red;Sicilia, Sicily & Sardinia, Italy;Gorghi Tondi;KERIN O’KEEFE;12.5%;750 ml;Red;Sheehan Brothers;3/1/2020
Leather, underbrush, menthol and moist soil aromas form the nose. On the palate, brisk acidity accompanies dried cherry, powdered sage and a hint of tobacco leaf alongside assertive close-grained tannins. KERIN O’KEEFE;87;Il Chiosso 2013 Gattinara;$32;;Nebbiolo;Gattinara, Piedmont, Italy;Il Chiosso;KERIN O’KEEFE;13%;750 ml;Red;Vias Imports;3/1/2020
Made with organically grown Nero d'Avola, this has aromas of ripe dark-skinned fruit and tilled soil. The mature palate offers blackberry extract, star anise and cocoa alongside smooth tannins. Drink soon. KERIN O’KEEFE;87;Cantine Grasso 2017 Lilium Nero d'Avola (Sicilia);N/A;Lilium;Nero d'Avola, Italian Red;Sicilia, Sicily & Sardinia, Italy;Cantine Grasso;KERIN O’KEEFE;13%;750 ml;Red;Tuttovino LLC;3/1/2020
This Nero d'Avola has aromas suggesting dark-skinned fruit and baking spice. The round palate offers blackberry jam, vanilla and a hint of cooking spice alongside smooth tannins. Drink soon. KERIN O’KEEFE;87;Cantine Grasso 2017 Sette Aia Nero d'Avola (Sicilia);N/A;Sette Aia;Nero d'Avola, Italian Red;Sicilia, Sicily & Sardinia, Italy;Cantine Grasso;KERIN O’KEEFE;13.5%;750 ml;Red;Tuttovino LLC;3/1/2020
Made with organically grown Nerello Mascalese, this opens with delicate aromas of red berry and underbrush. The lean, linear palate offers sour cherry and a hint of star anise alongside lithe tannins. Drink soon. KERIN O’KEEFE;87;Cortese 2018 Nerello Mascalese (Terre Siciliane);$15;;Nerello Mascalese, Italian Red;Terre Siciliane, Sicily & Sardinia, Italy;Cortese;KERIN O’KEEFE;13%;750 ml;Red;Saranty Imports;3/1/2020
This has a shy nose that eventually reveals aromas of toasted nut and pressed acacia flower. On the lean, somewhat evolved palate, tangy acidity accompanies dried pineapple slice and a hint of green melon before a white-almond close. KERIN O’KEEFE;87;Cusumano 2015 Cubia Insolia (Sicilia);$30;Cubia;Insolia, Italian White;Sicilia, Sicily & Sardinia, Italy;Cusumano;KERIN O’KEEFE;12%;750 ml;White;Terlato Wines International;3/1/2020
This opens with aromas of cassis and star anise. The simple palate offers blackberry, vanilla and white pepper alongside smooth tannins. Drink soon. KERIN O’KEEFE;87;Feudo Arancio 2017 Cabernet Sauvignon (Sicilia);$14;;Cabernet Sauvignon;Sicilia, Sicily & Sardinia, Italy;Feudo Arancio;KERIN O’KEEFE;13.5%;750 ml;Red;Prestige Wine Imports Corp;3/1/2020
Intense aromas of spring blossom, white stone fruit and Meyer lemon lift out of the glass. The crisp, light-bodied palate isn't quite as expressive as the nose, suggesting peach and citrus alongside vibrant acidity. It closes on a hint of white almond. KERIN O’KEEFE;87;MandraRossa 2017 Bertolino Soprano Grillo (Sicilia);$43;Bertolino Soprano;Grillo, Italian White;Sicilia, Sicily & Sardinia, Italy;MandraRossa;KERIN O’KEEFE;12.5%;750 ml;White;Palm Bay International;3/1/2020
A deeply hued, golden-yellow, this aged white wine has a shy nose that eventually gives up whiffs of wet stone, pressed acacia flower and the barest hint of honey. Reflecting the nose, the lean, subdued palate suggests saline, bitter walnut and the merest hint of dried apricot. Drink soon to capture what little fruit remains. KERIN O’KEEFE;86;Antico Castello 2014 Mida Greco (Irpinia);$40;Mida;Greco, Italian White;Irpinia, Southern Italy, Italy;Antico Castello;KERIN O’KEEFE;13.5%;750 ml;White;Matinicus Wines, LLC;3/1/2020
Aromas suggesting yellow stone fruit and vanilla form the delicate nose. The palate is less expressive and on the lean side, offering dried peach slice, orange zest and a hint of toasted almond alongside tangy acidity. KERIN O’KEEFE;86;Olianas 2018 Vermentino di Sardegna;N/A;;Vermentino, Italian White;Vermentino di Sardegna, Sicily & Sardinia, Italy;Olianas;KERIN O’KEEFE;13.5%;750 ml;White;Cline Cellars;3/1/2020
Lean and light-bodied, this has aromas of Meyer lemon, sea brine and a hint of yellow-apple skin. The aromas follow over to the brisk, simple palate along before closing on a note of bitter almond. KERIN O’KEEFE;86;Contrada Salandra 2016 Falanghina (Campi Flegrei);N/A;;Falanghina, Italian White;Campi Flegrei, Southern Italy, Italy;Contrada Salandra;KERIN O’KEEFE;13%;750 ml;White;David Bowler Wine;3/1/2020
Made with organically grown Nero d'Avola, this informal wine opens with aromas of dark berry and cooking spice. The aromas carry over to the simple palate along with smooth tannins and the merest touch of white pepper. Drink soon. KERIN O’KEEFE;86;Cantine Ermes 2018 Vento di Mare Bio Nero d'Avola (Sicilia);$9;Vento di Mare Bio;Nero d'Avola, Italian Red;Sicilia, Sicily & Sardinia, Italy;Cantine Ermes;KERIN O’KEEFE;13.5%;750 ml;Red;USA Wine West;3/1/2020
Smooth and easygoing, this light-bodied red has aromas of wild red berry and whiffs of dark spice. On the soft, simple palate, pliant tannins loosely support fleshy blackberry and a hint of tobacco. Drink now. KERIN O’KEEFE;86;La Guardiense 2017 Janare Aglianico (Beneventano);$12;Janare;Aglianico, Italian Red;Beneventano, Southern Italy, Italy;La Guardiense;KERIN O’KEEFE;12.5%;750 ml;Red;Monsieur Touton Selection Ltd;3/1/2020
Subtle aromas suggesting Mediterranean scrub and white stone fruit waft out of the glass. It's simple but well made, offering pineapple and citrus alongside tangy acidity. KERIN O’KEEFE;86;Tenuta Bastonaca 2018 Grillo (Sicilia);N/A;;Grillo, Italian White;Sicilia, Sicily & Sardinia, Italy;Tenuta Bastonaca;KERIN O’KEEFE;12.5%;750 ml;White;Florio Imports;3/1/2020
Informal and easy drinking, this simple wine suggests sour cherry, pomegranate and the barest hint of spice. Loose-knit, rather fleeting tannins offer light support. KERIN O’KEEFE;86;Gabbas 2018 Lillovè (Cannonau di Sardegna);$23;Lillovè;Cannonau, Grenache;Cannonau di Sardegna, Sicily & Sardinia, Italy;Gabbas;KERIN O’KEEFE;14%;750 ml;Red;Tellitalia Imports;3/1/2020
This easygoing white has subtle aromas suggesting white stone fruit and almond. Reflecting the nose, the crisp, simple palate suggests yellow apple and bitter nut before a tangy finish. KERIN O’KEEFE;86;Gorghi Tondi 2018 Coste a Preola Grillo (Sicilia);$16;Coste a Preola;Grillo, Italian White;Sicilia, Sicily & Sardinia, Italy;Gorghi Tondi;KERIN O’KEEFE;12%;750 ml;White;Sheehan Brothers;3/1/2020
Aromas of tropical fruit and spring flower lead the nose. On the simple, fruity palate, tangy acidity accompanies banana and honeydew melon before a candied lemon drop close. KERIN O’KEEFE;86;Iorio 2017 Falanghina (Beneventano);$16;;Falanghina, Italian White;Beneventano, Southern Italy, Italy;Iorio;KERIN O’KEEFE;13%;750 ml;White;Golden Vines;3/1/2020
Made with Nero d'Avola, this easygoing red has subdued aromas of dark-skinned fruit and a whiff of brown spice. The simple palate offers mature black plum, tangerine zest and a dollop of vanilla alongside round tannins. Drink soon. KERIN O’KEEFE;86;Nero Oro 2018 Nero d'Avola (Terre Siciliane);$13;;Nero d'Avola, Italian Red;Terre Siciliane, Sicily & Sardinia, Italy;Nero Oro;KERIN O’KEEFE;14%;750 ml;Red;Saranty Imports;3/1/2020
This has subdued aromas that offers mere suggestions of honeydew melon, apricot and bitter almond. The aromas carry on to the simple, rather diluted palate along with brisk acidity. KERIN O’KEEFE;86;Nuraghe Crabioni 2018 Crabioni (Vermentino di Sardegna);$19;Crabioni;Vermentino, Italian White;Vermentino di Sardegna, Sicily & Sardinia, Italy;Nuraghe Crabioni;KERIN O’KEEFE;13%;750 ml;White;Vias Imports;3/1/2020
Made with organically grown Nero d'Avola, this has aromas of dark fruit and baking spice that carry over to the easygoing palate along with round tannins and the merest hint of black pepper. Drink soon. KERIN O’KEEFE;86;TerrAmore 2018 Nero d'Avola (Sicilia);$11;;Nero d'Avola, Italian Red;Sicilia, Sicily & Sardinia, Italy;TerrAmore;KERIN O’KEEFE;13%;750 ml;Red;Saranty Imports;3/1/2020
This has an extremely subdued nose suggesting mature stone fruit and a whiff of pressed yellow flower. The rather evolved, monolithic palate evokes dried yellow apple slice, saline and the heat of evident alcohol that dominates the finish. KERIN O’KEEFE;85;Amarano 2017 Cardenio (Greco di Tufo);N/A;Cardenio;Greco, Italian White;Greco di Tufo, Southern Italy, Italy;Amarano;KERIN O’KEEFE;14.5%;750 ml;White;1_No Submitting Co;3/1/2020
Blueberry and violet aromas mingle with Mediterranean brush and toasted notes. The assertive, lean palate is far less expressive, offering dark spice and the heat of evident alcohol. It lacks fruit richness while dusty, drying tannins leave an abrupt, astringent finish. KERIN O’KEEFE;85;F.lli Puddu 2015 Nepente di Oliena Pro Vois Riserva (Cannonau di Sardegna);$40;Nepente di Oliena Pro Vois Riserva;Cannonau, Grenache;Cannonau di Sardegna, Sicily & Sardinia, Italy;F.lli Puddu;KERIN O’KEEFE;15%;750 ml;Red;Enotria Wine Import;3/1/2020
Aromas of toasted walnut dominate the nose and carry over to the brisk palate along with yellow-apple skin. It's crisp, with tangy acidity but it's lean on fruit richness. KERIN O’KEEFE;85;Funaro 2018 Pinzeri Grillo (Sicilia);$22;Pinzeri;Grillo, Italian White;Sicilia, Sicily & Sardinia, Italy;Funaro;KERIN O’KEEFE;13.5%;750 ml;White;Yountville Wine Imports;3/1/2020
This informal white has aromas of white spring flower and tropical fruit. On the lean, diluted palate, brisk acidity accompanies mere suggestions of banana, pineapple and honeydew melon. KERIN O’KEEFE;85;Vesevo 2018 Falanghina (Beneventano);N/A;;Falanghina, Italian White;Beneventano, Southern Italy, Italy;Vesevo;KERIN O’KEEFE;12.5%;750 ml;White;Gonzalez Byass USA;3/1/2020
This extremely simple white has aromas of white stone fruit and almond. The aromas flow through to the light, easygoing palate along with tropical fruit notes and tangy acidity. KERIN O’KEEFE;85;Dolia Nova 2018 Vermentino di Sardegna;$13;;Vermentino, Italian White;Vermentino di Sardegna, Sicily & Sardinia, Italy;Dolia Nova;KERIN O’KEEFE;12.5%;750 ml;White;Saranty Imports;3/1/2020
The shy nose eventually reveals aromas suggesting prune, weedy underbrush and toasted oak that carry over to the lean, rather diluted palate along with coffee bean and saw dust. It seems more evolved than its age, with loose, fleeting tannins. Drink sooner rather than later. KERIN O’KEEFE;85;Nativ 2016 Rue (Taurasi);$45;Rue;Aglianico, Italian Red;Taurasi, Southern Italy, Italy;Nativ;KERIN O’KEEFE;14%;750 ml;Red;Montcalm Wine Importers;3/1/2020
This informal Nero d'Avola has aromas suggesting dark-skinned fruit and scorched earth. The simple palate offers blackberry and a hint of star anise alongside relaxed tannins. Drink soon. KERIN O’KEEFE;84;Botter 2018 Caleo Nero d'Avola (Sicilia);$10;Caleo;Nero d'Avola, Italian Red;Sicilia, Sicily & Sardinia, Italy;Botter;KERIN O’KEEFE;13%;750 ml;Red;Saranty Imports;3/1/2020
Here's an informal white that has aromas evoking banana and exotic fruit. The aromas make their way over to the diluted palate along with brisk acidity before a rather bitter finish. KERIN O’KEEFE;84;Antica Hirpinia 2018 Greco di Tufo;N/A;;Greco, Italian White;Greco di Tufo, Southern Italy, Italy;Antica Hirpinia;KERIN O’KEEFE;13.5%;750 ml;White;Francoli USA;3/1/2020
Aromas of Mediterranean scrub and grilled herb lead the nose on this informal red. The light-bodied, diluted palate suggests dried blackberry, a green note of powdered sage and bitter unroasted coffee bean alongside dusty fleeting tannins. KERIN O’KEEFE;84;Dolia Nova 2018 Monica di Sardegna;$13;;Monica, Italian Red;Monica di Sardegna, Sicily & Sardinia, Italy;Dolia Nova;KERIN O’KEEFE;13%;750 ml;Red;Saranty Imports;3/1/2020
Roasted herb and Mediterranean brush aromas mingle with a whiff of toasted nut on this extremely simple wine. The diluted palate lacks fruit richness while dusty, fleeting tannins give it a drying, abrupt finish. KERIN O’KEEFE;83;Dolia Nova 2018 Cannonau di Sardegna;$13;;Cannonau, Grenache;Cannonau di Sardegna, Sicily & Sardinia, Italy;Dolia Nova;KERIN O’KEEFE;13.5%;750 ml;Red;Saranty Imports;3/1/2020
This informal white has subdued aromas suggesting white stone fruit and a whiff of spring flower. The extremely simple, rather diluted palate offers mere suggestions of yellow apple and lemon alongside brisk acidity. KERIN O’KEEFE;83;Cantine Grasso 2018 Grillo (Sicilia);N/A;;Grillo, Italian White;Sicilia, Sicily & Sardinia, Italy;Cantine Grasso;KERIN O’KEEFE;12%;750 ml;White;Tuttovino LLC;3/1/2020
Fragrant, structured and loaded with finesse and complexity, this stunning, perfumed wine opens with alluring scents evoking new leather, pressed rose, eucalyptus, cinnamon and carob. It's vibrant, focused and bestowed with incredible energy, delivering crushed raspberry, red cherry, licorice and savory mineral notes. Bright acidity and polished tannins lend remarkable elegance and precision. It's the best wine from this challenging vintage. Drink 2022–2036. KERIN O’KEEFE;99;Roagna 2014 Asili Vecchie Viti (Barbaresco);$225;Asili Vecchie Viti;Nebbiolo;Barbaresco, Piedmont, Italy;Roagna;KERIN O’KEEFE;14%;750 ml;Red;Polaner Selections;1/1/2020
Yet another incredible showing from the estate's dazzling range of 2014 Barbarescos, this opens with enticing scents of dark spice, camphor, new leather and wild red berry. The palate boasts a weightless concentration, delivering bright red cherry, strawberry jelly, orange zest and licorice alongside taut, polished tannins. Bright acidity keeps it lifted and balanced, and a hazelnut note caps off the close. Drink 2024–2034. KERIN O’KEEFE;98;Roagna 2014 Pajè Vecchie Viti (Barbaresco);$225;Pajè Vecchie Viti;Nebbiolo;Barbaresco, Piedmont, Italy;Roagna;KERIN O’KEEFE;14%;750 ml;Red;Polaner Selections;1/1/2020
Aromas of rose, red berry and eucalyptus mingle with whiffs of exotic spice on the gorgeous, fragrant red. Loaded with finesse and tension, the elegant, structured palate delivers crushed raspberry, white pepper and star anise set against fresh acidity and taut, lithe tannins. It's already compelling, but hold for even more complexity. Drink 2022–2036. KERIN O’KEEFE;98;Gaja 2016 Barbaresco;$250;;Nebbiolo;Barbaresco, Piedmont, Italy;Gaja;KERIN O’KEEFE;14%;750 ml;Red;Terlato Wines International;1/1/2020
Rose petal, camphor, eucalyptus and dark-skinned-berry aromas shape the nose on this captivating wine. Vibrant and intense, the palate evokes spiced cranberry, red cherry, licorice, espresso and a hint of orange zest alongside taut, fine-grained tannins. It's still youthfully austere but already balanced, with firm acidity. Drink 2024–2041. KERIN O’KEEFE;98;Gaja 2016 Sorì San Lorenzo (Barbaresco);$590;Sorì San Lorenzo;Nebbiolo;Barbaresco, Piedmont, Italy;Gaja;KERIN O’KEEFE;14%;750 ml;Red;Terlato Wines International;1/1/2020
My highest scoring Barolo of the vintage (out of over 300 reviewed so far), this gorgeous wine has heady aromas of violet, rose, baking spice and ripe, red berry. On the smooth, juicy palate, taut, polished tannins support succulent red cherry, raspberry compote, licorice and wild herbs. It's already delicious and accessible but will also age well for years to come. Drink through 2035. KERIN O’KEEFE;98;Cantina Bartolo Mascarello 2015 Barolo;$250;;Nebbiolo;Barolo, Piedmont, Italy;Cantina Bartolo Mascarello;KERIN O’KEEFE;14.5%;750 ml;Red;Polaner Selections;1/1/2020
Structured, tense and racy, this offers layers of red cherry, raspberry, dark spice and balsamic flavors of camphor. It has a Barolo-like structure, with firm, well-integrated tannins and vibrant acidity, and a licorice note lingers on the long finish. Give it time to fully develop, and you'll be rewarded. Drink 2024–2034. KERIN O’KEEFE;98;Roagna 2014 Montefico Vecchie Viti (Barbaresco);$225;Montefico Vecchie Viti;Nebbiolo;Barbaresco, Piedmont, Italy;Roagna;KERIN O’KEEFE;14%;750 ml;Red;Polaner Selections;1/1/2020
Aromas of wild red berry, rose petal, wet stone, Mediterranean brush and star anise shape the nose on this compelling, vibrant wine. Made with Nerello Mascalese planted in 1961, the wine has a linear, racy palate that's almost ethereal and loaded with finesse and energy, delivering sour cherry, pomegranate, licorice and orange zest before a flinty mineral close. Taut, refined tannins and vibrant acidity lend lithe support. Drink 2024–2036. KERIN O’KEEFE;97;Tascante 2016 Contrada Sciaranuova VV Rosso (Etna);$120;Contrada Sciaranuova VV Rosso;Nerello Mascalese, Italian Red;Etna, Sicily & Sardinia, Italy;Tascante;KERIN O’KEEFE;13.5%;750 ml;Red;Dalla Terra Winery Direct;1/1/2020
Balsamic aromas of camphor mingle with red berry, underbrush and dark spice on this vibrant red. On the delicious, radiant palate, bright acidity and elegant tannins accompany raspberry compote, crushed strawberry and star anise before an orange zest finish. Drink 2021–2029. KERIN O’KEEFE;97;Roagna 2014 Gallina (Barbaresco);$112;Gallina;Nebbiolo;Barbaresco, Piedmont, Italy;Roagna;KERIN O’KEEFE;14%;750 ml;Red;Polaner Selections;1/1/2020
