This opens with fruity aromas of red berry, star anise and violet. The aromas carry through to the juicy palate alongside notes of black cherry and white pepper. Enjoy soon. KERIN O’KEEFE;89;Valle dell'Acate 2018 Bellifolli Nero d'Avola (Sicilia);$18;Bellifolli;Nero d'Avola, Italian Red;Sicilia, Sicily & Sardinia, Italy;Valle dell'Acate;KERIN O’KEEFE;13%;750 ml;Red;Skurnik Wines, Inc;1/1/2020
Floral and fruity, this has aromas of honeysuckle, Bartlett pear and exotic fruit. On the off-dry palate, a creamy mousse accompanies ripe yellow apple, honeydew and acacia honey. KERIN O’KEEFE;89;Ciodet 2018 Giosuè Extra Dry (Valdobbiadene Prosecco Superiore);$23;Giosuè Extra Dry;Glera, Italian White;Valdobbiadene Prosecco Superiore, Veneto, Italy;Ciodet;KERIN O’KEEFE;11.5%;750 ml;Sparkling;Solstars;1/1/2020
This enjoyable white has aromas evoking spring flower and citrus with a whiff of exotic fruit. The linear, tangy palate reflects the nose, offering apricot, pineapple and grapefruit notes before a saline close. KERIN O’KEEFE;89;Cusumano 2018 Shamaris Grillo (Sicilia);$22;Shamaris;Grillo, Italian White;Sicilia, Sicily & Sardinia, Italy;Cusumano;KERIN O’KEEFE;12.5%;750 ml;White;Terlato Wines International;1/1/2020
Dark berry, star anise and cedar aromas form the nose. On the round palate, polished tannins accompany blackberry jam, tobacco and clove. Enjoy soon. KERIN O’KEEFE;89;Donnafugata 2017 Sedàra Red (Sicilia);$17;Sedàra;Red Blends, Red Blends;Sicilia, Sicily & Sardinia, Italy;Donnafugata;KERIN O’KEEFE;13.5%;750 ml;Red;Folio Fine Wine Partners;1/1/2020
Aromas of honeysuckle and Granny Smith apple jump out of the glass. The green apple aroma carries on to the racy palate together with lemon zest and yellow peach. A vibrant perlage provides the backdrop. KERIN O’KEEFE;89;Maschio dei Cavalieri 2018 Rive di Colbertaldo Brut (Valdobbiadene Prosecco Superiore);$22;Rive di Colbertaldo Brut;Glera, Italian White;Valdobbiadene Prosecco Superiore, Veneto, Italy;Maschio dei Cavalieri;KERIN O’KEEFE;11.5%;750 ml;Sparkling;Frederick Wildman & Sons, Ltd;1/1/2020
Made with 80% Nerello Mascalese and 20% Nerello Cappuccio, this has aromas of French oak and exotic spice that carry on to the tightly knit palate along with coconut, licorice, incense and a hint of dried berry. Firm, grainy tannins leave an astringent, drying finish. Give the tannins a few years to unwind, then drink sooner rather than later to capture the remaining fruit richness. KERIN O’KEEFE;89;Palmento Costanzo 2015 Nero di Sei (Etna);$45;Nero di Sei;Red Blends, Red Blends;Etna, Sicily & Sardinia, Italy;Palmento Costanzo;KERIN O’KEEFE;14%;750 ml;Red;Artisanal Cellars;1/1/2020
Acacia and ripe pear aromas create an inviting nose. Crisp and savory, the palate offers ripe golden apple, peach and lemon drop candy alongside a soft perlage and racy acidity. It closes on an almond note. KERIN O’KEEFE;89;Tenuta 2 Castelli NV Brut (Valdobbiadene Prosecco Superiore);$16;Brut;Glera, Italian White;Valdobbiadene Prosecco Superiore, Veneto, Italy;Tenuta 2 Castelli;KERIN O’KEEFE;11%;750 ml;Sparkling;Veneto Hills;1/1/2020
This has aromas suggesting white spring flower and white stone fruit. The ripe palate shows mature pear, yellow apple and a hint of mineral alongside a hazelnut note. KERIN O’KEEFE;89;Tenuta Sarno 1860 2017 Fiano di Avellino;$28;;Fiano, Italian White;Fiano di Avellino, Southern Italy, Italy;Tenuta Sarno 1860;KERIN O’KEEFE;13%;750 ml;White;Caroline Debbané Selections;1/1/2020
Wisteria and Granny Smith apple aromas dominate the fragrant nose. On the off-dry, rather sweet palate, a foaming mousse accompanies ripe yellow pear, lemon drop candy and bitter almond. Bright acidity lifts the rich flavors. KERIN O’KEEFE;89;Andreola 2018 Dry (Valdobbiadene Superiore di Cartizze);$40;Dry;Glera, Italian White;Valdobbiadene Superiore di Cartizze, Veneto, Italy;Andreola;KERIN O’KEEFE;11.5%;750 ml;Sparkling;Siena Imports;1/1/2020
Aromas of hawthorn and jasmine mingle with scents of white orchard fruit. On the tangy palate, crisp acidity accompanies ripe yellow apple and Meyer lemon before an almond close. KERIN O’KEEFE;89;Rossovermiglio 2016 Greco (Sannio);N/A;;Greco, Italian White;Sannio, Southern Italy, Italy;Rossovermiglio;KERIN O’KEEFE;12.5%;750 ml;White;1_No Submitting Co;1/1/2020
A blend of 80% Nerello Mascalese and 20% Nerello Cappuccio, this has inviting aromas of wild berry, blue flower and Asian spice with a toasted note. On the full-bodied palate, taut, fine-grained tannins accompany dried cherry, espresso and a hint of ground clove before a rather lean, mouthdrying finish. KERIN O’KEEFE;89;Terrazze dell'Etna 2015 Carusu (Etna);$18;Carusu;Red Blends, Red Blends;Etna, Sicily & Sardinia, Italy;Terrazze dell'Etna;KERIN O’KEEFE;14.5%;750 ml;Red;Ethica Wines;1/1/2020
Ripe black-skinned berry, wild mint and carob aromas take center stage in this round red. The aromas carry over to the juicy, smooth palate along with blackberry jam and a hint of baking spice. Soft tannins offer light support. Drink soon. KERIN O’KEEFE;89;Caruso & Minini 2018 Terre di Giumara Nero d'Avola (Sicilia);$14;Terre di Giumara;Nero d'Avola, Italian Red;Sicilia, Sicily & Sardinia, Italy;Caruso & Minini;KERIN O’KEEFE;13.5%;750 ml;Red;Massanois Imports;1/1/2020
This refreshing sparkler opens with delicate scents of white spring flower and ripe pear. On the crisp palate, a vibrant perlage accompanies Granny Smith apple and lemon drop candy. KERIN O’KEEFE;88;BiancaVigna NV Brut (Prosecco);$15;Brut;Glera, Italian White;Prosecco, Veneto, Italy;BiancaVigna;KERIN O’KEEFE;11.5%;750 ml;Sparkling;Indigenous Selections;1/1/2020
This polished sparkler opens with heady scents of white spring flower and white orchard fruit. The softly foaming palate offers ripe pear, white peach and grapefruit before a lemon drop candy finish. KERIN O’KEEFE;88;Cà di Rajo 2018 Extra Dry (Valdobbiadene Prosecco Superiore);$22;Extra Dry;Glera, Italian White;Valdobbiadene Prosecco Superiore, Veneto, Italy;Cà di Rajo;KERIN O’KEEFE;N/A;750 ml;Sparkling;The Barterhouse;1/1/2020
Made with organically grown Nero d'Avola, this has aromas of dark berry, Mediterranean scrub and cedar. The savory palate offers black cherry jam, tobacco and raw almond alongside smooth tannins. Enjoy soon. KERIN O’KEEFE;88;Caruso & Minini 2018 Naturalmente Bio Nero d'Avola (Sicilia);$19;Naturalmente Bio;Nero d'Avola, Italian Red;Sicilia, Sicily & Sardinia, Italy;Caruso & Minini;KERIN O’KEEFE;13.5%;750 ml;Red;Massanois Imports;1/1/2020
Green apple and fragrant spring flower aromas lead the nose. The palate delivers ripe pear, Meyer lemon and bitter almond alongside crisp acidity and a lively perlage. KERIN O’KEEFE;88;Ciodet NV Gelmo Extra Dry (Valdobbiadene Prosecco Superiore);$23;Gelmo Extra Dry;Glera, Italian White;Valdobbiadene Prosecco Superiore, Veneto, Italy;Ciodet;KERIN O’KEEFE;11.5%;750 ml;Sparkling;Solstars;1/1/2020
Aromas of wisteria, hawthorn and pear shape the nose along with whiffs of citrus. On the vibrant palate, crisp acidity and a foaming mousse provide the background for Granny Smith apple and tangerine drop candy before a white almond close. KERIN O’KEEFE;88;Merotto NV Colbelo Extra Dry (Valdobbiadene Prosecco Superiore);$17;Colbelo Extra Dry;Glera, Italian White;Valdobbiadene Prosecco Superiore, Veneto, Italy;Merotto;KERIN O’KEEFE;11%;750 ml;Sparkling;Prestige Wine Imports Corp;1/1/2020
Aromas of blue flower, mature berry and wild herbs lead the way. On the straightforward palate, polished tannins accompany dried black cherry and baking spice. KERIN O’KEEFE;88;Patria 2017 Femina (Etna);$29;Femina;Nerello Mascalese, Italian Red;Etna, Sicily & Sardinia, Italy;Patria;KERIN O’KEEFE;14%;750 ml;Red;Opera Wine Imports;1/1/2020
Aromas of dark-skinned fruit, baking spice and tilled soil emerge from the glass. The linear palate offers sour cherry, clove and star anise alongside firm tannins. Drink after 2021. KERIN O’KEEFE;88;Rivata 2015 Barbaresco;$22;;Nebbiolo;Barbaresco, Piedmont, Italy;Rivata;KERIN O’KEEFE;14%;750 ml;Red;Saranty Imports;1/1/2020
Spring blossom, apricot and tropical fruit aromas shape the nose. On the tangy palate, a soft mousse accompanies yellow peach and ripe pear before a lemon drop candy finish. Fresh acidity brightens the rich flavors. KERIN O’KEEFE;88;Zardetto NV Extra Dry (Conegliano Valdobbiadene Prosecco Superiore);$24;Extra Dry;Glera, Italian White;Conegliano Valdobbiadene Prosecco Superiore, Veneto, Italy;Zardetto;KERIN O’KEEFE;11.5%;750 ml;Sparkling;LLS–Winebow;1/1/2020
Delicate aromas of hawthorn mingle with a whiff of tropical fruit. The medium-bodied palate suggests lemon zest, dried pineapple and bitter almond before a saline close. KERIN O’KEEFE;88;Donnachiara 2017 Aletheia (Greco di Tufo);$30;Aletheia;Greco, Italian White;Greco di Tufo, Southern Italy, Italy;Donnachiara;KERIN O’KEEFE;13%;750 ml;White;Michelangelo Selections;1/1/2020
Delicate scents of white spring flower and whiffs of tropical fruit waft out of the glass. On the palate, tangy acidity lifts pineapple, mature yellow apple and a hint of toasted almond. KERIN O’KEEFE;88;Feudo Arancio 2018 Chardonnay (Sicilia);$14;;Chardonnay;Sicilia, Sicily & Sardinia, Italy;Feudo Arancio;KERIN O’KEEFE;N/A;750 ml;White;Prestige Wine Imports Corp;1/1/2020
Yellow stone fruit and fragrant spring flower aromas lead the nose. Made with organically grown grapes, the tangy palate offers white grapefruit, apricot and tangerine drop candy alongside bright acidity. KERIN O’KEEFE;88;Feudo di Santa Tresa 2018 Rina Ianca White (Sicilia);$14;Rina Ianca;White Blend;Sicilia, Sicily & Sardinia, Italy;Feudo di Santa Tresa;KERIN O’KEEFE;13%;750 ml;White;Vias Imports;1/1/2020
Made entirely from Nero d'Avola, this opens with dark berry, carob and Mediterranean brush aromas. The linear, savory palate offers blackberry, raspberry jam and black pepper alongside velvety tannins. Drink soon. KERIN O’KEEFE;88;Feudo Arancio 2017 Nero d'Avola (Sicilia);$14;;Nero d'Avola, Italian Red;Sicilia, Sicily & Sardinia, Italy;Feudo Arancio;KERIN O’KEEFE;13%;750 ml;Red;Prestige Wine Imports Corp;1/1/2020
Heady scents of green apple and honeysuckle lead the nose. The apple aroma follows over to the foaming palate along with white peach and citrus zest. Crisp acidity lifts the white almond finish. KERIN O’KEEFE;88;La Tordera 2018 Brunei Brut (Valdobbiadene Prosecco Superiore);$20;Brunei Brut;Glera, Italian White;Valdobbiadene Prosecco Superiore, Veneto, Italy;La Tordera;KERIN O’KEEFE;11.5%;750 ml;Sparkling;Schneider's of Capitol Hill;1/1/2020
Subtle aromas of yellow apple, citrus zest and crushed botanical herbs follow over to the dry, racy palate along with mature pear. Vivacious bubbles provide the backdrop. KERIN O’KEEFE;88;Silvano Follador 2018 Brut Nature (Valdobbiadene Prosecco Superiore);$29;Brut Nature;Glera, Italian White;Valdobbiadene Prosecco Superiore, Veneto, Italy;Silvano Follador;KERIN O’KEEFE;11%;750 ml;Sparkling;Grand Cru Selections;1/1/2020
Floral aromas of wisteria and honeysuckle combine with tropical fruit on this fragrant sparkler. On the racy palate, a vibrant perlage offsets Granny Smith apple and white peach before a bitter almond close. KERIN O’KEEFE;88;Tenuta 2 Castelli NV Extra Dry (Valdobbiadene Prosecco Superiore);$16;Extra Dry;Glera, Italian White;Valdobbiadene Prosecco Superiore, Veneto, Italy;Tenuta 2 Castelli;KERIN O’KEEFE;11%;750 ml;Sparkling;Veneto Hills;1/1/2020
This fragrant, unusual expression of Carricante has vivid aromas of crushed tomato vine, grapefruit and green melon. The aromas carry on the tangy, slightly more subdued palate along with mature yellow apple, pineapple and bright acidity before a slightly honeyed close. KERIN O’KEEFE;88;Vivera 2015 Salire Contrada Martinella Biacno (Etna);$35;Salire Contrada Martinella Biacno;Carricante, Italian White;Etna, Sicily & Sardinia, Italy;Vivera;KERIN O’KEEFE;13%;750 ml;White;Montcalm Wine Importers;1/1/2020
Aromas of scorched earth, brimstone and mature blackberry lead the nose. On the lively palate, vigorous acidity accompanies ripe black cherry, roasted hazelnut, espresso and licorice alongside grainy tannins. KERIN O’KEEFE;88;Vivera 2017 Rosso (Etna);$30;Rosso;Red Blends, Red Blends;Etna, Sicily & Sardinia, Italy;Vivera;KERIN O’KEEFE;13.5%;750 ml;Red;Montcalm Wine Importers;1/1/2020
Scents of white spring wildflower and white stone fruit shape the delicate nose. Softly sparkling and fresh, it offers Granny Smith apple, white peach and white almond before a lemon drop candy close. It's bright, with tangy acidity. KERIN O’KEEFE;88;Astoria NV Extra Dry (Valdobbiadene Prosecco Superiore);$19;Extra Dry;Glera, Italian White;Valdobbiadene Prosecco Superiore, Veneto, Italy;Astoria;KERIN O’KEEFE;11%;750 ml;Sparkling;Prestige Beverage Group;1/1/2020
Invigorating aromas of spring wildflower, white stone fruit and citrus form the nose. Reflecting the aromas, the crisp palate offers yellow apple, grapefruit, beeswax and bitter almond alongside a lively perlage. KERIN O’KEEFE;88;Cà di Rajo 2018 Cuvée del Fondatore (Valdobbiadene Prosecco Superiore);$23;Cuvée del Fondatore;Glera, Italian White;Valdobbiadene Prosecco Superiore, Veneto, Italy;Cà di Rajo;KERIN O’KEEFE;11%;750 ml;Sparkling;The Barterhouse;1/1/2020
This softly foaming sparkler has aromas of green apple, mature pear and citrus. The aromas carry on to the tangy palate along with a note of lemon drop candy and crisp acidity. KERIN O’KEEFE;88;Ciodet NV Labano Brut (Valdobbiadene Prosecco Superiore);$23;Labano Brut;Glera, Italian White;Valdobbiadene Prosecco Superiore, Veneto, Italy;Ciodet;KERIN O’KEEFE;11%;750 ml;Sparkling;Solstars;1/1/2020
This opens with aromas of black-skinned berry and mocha with a whiff of coconut. The lively palate offers blackberry jam, tobacco and licorice alongside polished tannins. Drink soon. KERIN O’KEEFE;88;Feudo Solaria 2016 Foglio Cinquanta Nero d'Avola (Sicilia);$15;Foglio Cinquanta;Nero d'Avola, Italian Red;Sicilia, Sicily & Sardinia, Italy;Feudo Solaria;KERIN O’KEEFE;13%;750 ml;Red;Tuttovino LLC;1/1/2020
Green apple aromas carry over to the softly foaming palate along with peach and lemon drop candy. Crisp acidity gives it a tangy, refreshing close. KERIN O’KEEFE;88;Loredan Gasparini NV Brut (Asolo Prosecco Superiore);$19;Brut;Glera, Italian White;Asolo Prosecco Superiore, Veneto, Italy;Loredan Gasparini;KERIN O’KEEFE;11%;750 ml;Sparkling;Lemma Wine Co Inc;1/1/2020
Aromas of Granny Smith apple, bitter almond and a confectionary note carry over to the foaming palate along with vanilla and lemon drop candy. Tangy acidity lifts the rich flavors. KERIN O’KEEFE;88;Masottina 2018 Le Rive di Ogliano Extra Dry (Valdobbiadene Prosecco Superiore);$27;Le Rive di Ogliano Extra Dry;Glera, Italian White;Valdobbiadene Prosecco Superiore, Veneto, Italy;Masottina;KERIN O’KEEFE;N/A;750 ml;Sparkling;Tri-Vin Imports;1/1/2020
Aromas of smoke, scorched earth and toasted hazelnut lead the nose. The aromas carry on to the rather lean palate along with sour cherry, lively acidity and dusty, drying tannins. KERIN O’KEEFE;88;Tenuta di Fessina 2017 Erse Rosso (Etna);$25;Erse Rosso;Red Blends, Red Blends;Etna, Sicily & Sardinia, Italy;Tenuta di Fessina;KERIN O’KEEFE;13%;750 ml;Red;Vineyard Brands;1/1/2020
Meyer lemon, oyster shell and wet stone aromas form the nose on this light-bodied white. The tangy, linear palate offers lime, yellow apple and saline along with crisp acidity. KERIN O’KEEFE;88;Cantine Astroni 2018 Colle Imperatrice Falanghina (Campi Flegrei);$20;Colle Imperatrice;Falanghina, Italian White;Campi Flegrei, Southern Italy, Italy;Cantine Astroni;KERIN O’KEEFE;12.5%;750 ml;White;The Vine Collective;1/1/2020
Made entirely from Nero d'Avola, this has aromas of black-skinned berry, Mediterranean herb and carob. The straightforward, juicy palate offers black cherry, raspberry jam and white pepper alongside polished tannins. Enjoy soon. KERIN O’KEEFE;88;Stemmari 2017 Estate Grown Sustainably Farmed Nero d'Avola (Sicilia);$11;Estate Grown Sustainably Farmed;Nero d'Avola, Italian Red;Sicilia, Sicily & Sardinia, Italy;Stemmari;KERIN O’KEEFE;13%;750 ml;Red;Prestige Wine Imports Corp;1/1/2020
Spanish broom, butterscotch and citrus zest aromas lead the way along with a medicinal whiff of adhesive bandage. The aromas carry over to the racy palate along with bitter almond, yellow apple skin and crisp acidity. KERIN O’KEEFE;87;Bellenda 2016 Rive di Carpesica Sei Uno Brut (Valdobbiadene Prosecco Superiore);$28;Rive di Carpesica Sei Uno Brut;Glera, Italian White;Valdobbiadene Prosecco Superiore, Veneto, Italy;Bellenda;KERIN O’KEEFE;11.5%;750 ml;Sparkling;Specialty Cellars;1/1/2020
Wisteria and banana aromas shape the nose. On the lightly foaming palate, bright acidity accompanies ripe pear, white peach and a lemon drop candy note. KERIN O’KEEFE;87;Brancher 2018 B Extra Dry (Valdobbiadene Prosecco Superiore);$19;B Extra Dry;Glera, Italian White;Valdobbiadene Prosecco Superiore, Veneto, Italy;Brancher;KERIN O’KEEFE;11%;750 ml;Sparkling;Vias Imports;1/1/2020
Softly foaming, this offers yellow apple, candied lemon slice, bitter almond and confectionary flavors. Racy acidity lends verve. KERIN O’KEEFE;87;Mionetto NV Luxury Collection Extra Dry (Valdobbiadene Prosecco Superiore);$20;Luxury Collection Extra Dry;Glera, Italian White;Valdobbiadene Prosecco Superiore, Veneto, Italy;Mionetto;KERIN O’KEEFE;11%;750 ml;Sparkling;Freixenet Mionetto USA;1/1/2020
Made with Cataratto and Grillo and aged in large casks, this deeply hued white has an extremely shy nose that eventually reveals whiffs of dried tropical fruit and oak. The evolved palate offers butterscotch, toast, lemon drop candy and mature yellow apple skin before a bitter close. Drink soon to capture the remaining fruit and freshness. KERIN O’KEEFE;87;Cortese 2017 Vanedda Bianco White (Terre Siciliane);$20;Vanedda Bianco;White Blend;Terre Siciliane, Sicily & Sardinia, Italy;Cortese;KERIN O’KEEFE;13.5%;750 ml;White;Saranty Imports;1/1/2020
Wisteria and tropical fruit aromas lead the nose. On the vibrant palate, crisp acidity and lively perlage frame white peach and green apple before a candied citrus slice close. KERIN O’KEEFE;87;Tenuta 2 Castelli 2018 Dry (Conegliano Valdobbiadene Prosecco Superiore);$19;Dry;Glera, Italian White;Conegliano Valdobbiadene Prosecco Superiore, Veneto, Italy;Tenuta 2 Castelli;KERIN O’KEEFE;11%;750 ml;Sparkling;Veneto Hills;1/1/2020
This Cabernet Sauvignon opens with cassis, tobacco and baking spice aromas. The straightforward palate offers blackberry, vanilla and white pepper alongside smooth tannins. KERIN O’KEEFE;87;Stemmari 2018 Estate Grown Sustainably Farmed Cabernet Sauvignon (Sicilia);$11;Estate Grown Sustainably Farmed;Cabernet Sauvignon;Sicilia, Sicily & Sardinia, Italy;Stemmari;KERIN O’KEEFE;13.5%;750 ml;Red;Prestige Wine Imports Corp;1/1/2020
Acacia flower and toasted nut aromas carry on to the palate along with citrus peel and mature yellow apple skin. Bitter walnut marks the close. KERIN O’KEEFE;87;Agricola Bellaria 2017 Ottant'anni Coda di Volpe (Irpinia);$15;Ottant'anni;Coda di Volpe, Italian White;Irpinia, Southern Italy, Italy;Agricola Bellaria;KERIN O’KEEFE;13%;750 ml;White;Alarich Distributing;1/1/2020
This mature white offers aromas of ripe yellow apple and acacia honey. The aromas carry over to the palate along with dried apricot and candied lemon zest before a bitter almond close. KERIN O’KEEFE;87;Amarano 2017 Dulcinea (Fiano di Avellino);N/A;Dulcinea;Fiano, Italian White;Fiano di Avellino, Southern Italy, Italy;Amarano;KERIN O’KEEFE;14%;750 ml;White;1_No Submitting Co;1/1/2020
Subdued aromas suggesting yellow spring flower and pear shape the delicate nose. The palate is straightforward and crisp, offering grapefruit and pineapple before a bitter almond close. KERIN O’KEEFE;87;Antica Masseria del Sigillo 2018 Fiano (Campania);$16;;Fiano, Italian White;Campania, Southern Italy, Italy;Antica Masseria del Sigillo;KERIN O’KEEFE;13%;750 ml;White;Enotec Imports, Inc;1/1/2020
Made with organically grown grapes, this has heady aromas of peach blossom, honeydew and ripe white stone fruit. The crisp, light-bodied palate isn't as expressive as the nose but is still enjoyable, suggesting yellow pear, green melon and lemon zest. KERIN O’KEEFE;87;Di Giovanna 2018 Vurria Grillo (Sicilia);$20;Vurria;Grillo, Italian White;Sicilia, Sicily & Sardinia, Italy;Di Giovanna;KERIN O’KEEFE;13.5%;750 ml;White;Regal Wine Imports Inc;1/1/2020
This Nero d'Avola opens with aromas suggesting dark berry and cooking spice. The straightforward palate offers raspberry jam and carob alongside smooth tannins. Drink soon. KERIN O’KEEFE;87;Fondo Antico 2017 Nero d'Avola (Sicilia);$14;;Nero d'Avola, Italian Red;Sicilia, Sicily & Sardinia, Italy;Fondo Antico;KERIN O’KEEFE;12.5%;750 ml;Red;Davigna Wines;1/1/2020
Aromas of honeysuckle and tropical fruit lift out of the glass. On the palate, tangy acidity accompanies honeydew, white grapefruit, lemon drop candy and a hint of saline. KERIN O’KEEFE;87;Fondo Antico 2018 Parlante Grillo (Sicilia);$15;Parlante;Grillo, Italian White;Sicilia, Sicily & Sardinia, Italy;Fondo Antico;KERIN O’KEEFE;13%;750 ml;White;Davigna Wines;1/1/2020
Aromas of green melon and honeysuckle form the nose. On the foaming palate, racy acidity brightens Granny Smith apple, bitter almond and a confectionary note. KERIN O’KEEFE;87;Le Colture NV Planer Extra Dry (Valdobbiadene Prosecco Superiore);$17;Planer Extra Dry;Glera, Italian White;Valdobbiadene Prosecco Superiore, Veneto, Italy;Le Colture;KERIN O’KEEFE;11.5%;750 ml;Sparkling;T. Edward Wines Ltd;1/1/2020
The rather shy nose offers aromas of medicinal herb and a hint of plastic. On the vibrant palate, vibrant acidity accompanies apple, citrus, pear and saline alongside bright acidity. KERIN O’KEEFE;87;Sorrentino 2018 Benita '31 Caprettone (Vesuvio);$16;Benita '31;Caprettone, Italian White;Vesuvio, Southern Italy, Italy;Sorrentino;KERIN O’KEEFE;12.5%;750 ml;White;Arte Vino;1/1/2020
This easygoing red opens with dark berry and Mediterranean brush aromas. The soft, savory palate offers black cherry, star anise and a hint of white pepper alongside velvety tannins. Drink soon. KERIN O’KEEFE;87;Colosi 2018 Nero d'Avola (Sicilia);$15;;Nero d'Avola, Italian Red;Sicilia, Sicily & Sardinia, Italy;Colosi;KERIN O’KEEFE;14%;750 ml;Red;Vias Imports;1/1/2020
This has aromas of white spring flower, medicinal herb and green apple. The apple aroma follows over to the crisp palate along with a candied note before a bitter finish. A vivacious perlage provides the setting. KERIN O’KEEFE;87;La Marca NV Luminore Brut (Conegliano Valdobbiadene Prosecco Superiore);$30;Luminore Brut;Glera, Italian White;Conegliano Valdobbiadene Prosecco Superiore, Veneto, Italy;La Marca;KERIN O’KEEFE;11%;750 ml;Sparkling;E. & J. Gallo;1/1/2020
Honeysuckle and ripe pear aromas form the delicate nose. On the bright palate, a foaming mousse and crisp acidity offset mature white peach and a hint of candied citrus drop. KERIN O’KEEFE;87;Terre di Rai 2018 Extra Dry (Valdobbiadene Prosecco Superiore);$20;Extra Dry;Glera, Italian White;Valdobbiadene Prosecco Superiore, Veneto, Italy;Terre di Rai;KERIN O’KEEFE;11%;750 ml;Sparkling;The Barterhouse;1/1/2020
This mature red has a shy nose that eventually reveals earthy whiffs of carob, underbrush, star anise and dried black-skinned fruit along with a whiff of scorched soil. On the evolved palate, dusty, drying tannins accompany dried black cherry and a hint of clove before a tangy close. Drink now. KERIN O’KEEFE;87;Patria 2005 Etna;$35;;Red Blends, Red Blends;Etna, Sicily & Sardinia, Italy;Patria;KERIN O’KEEFE;14.5%;750 ml;Red;Opera Wine Imports;1/1/2020
This fun sparkler has a shy, floral nose, while the foaming palate offers Granny Smith apple, honeydew and a candied note. Crisp acidity lifts the rich flavors. KERIN O’KEEFE;87;Ruggeri & C. NV Giall'oro Extra Dry (Valdobbiadene Prosecco Superiore);$22;Giall'oro Extra Dry;Glera, Italian White;Valdobbiadene Prosecco Superiore, Veneto, Italy;Ruggeri & C.;KERIN O’KEEFE;11%;750 ml;Sparkling;WinesU;1/1/2020
Aromas of French oak, coconut and blue flower lead the nose. The aromas carry over to the palate along with espresso, licorice and a green note of thyme, while grainy tannins leave an astringent close. It doesn't have the fruit richness to stand up to the dominant oak. KERIN O’KEEFE;87;Tenuta Rapitalà 2016 Etna;N/A;;Nerello Mascalese, Italian Red;Etna, Sicily & Sardinia, Italy;Tenuta Rapitalà;KERIN O’KEEFE;14%;750 ml;Red;1_Not Imported into US;1/1/2020
Aromas of white peach and toasted almond form the subtle nose. The vibrant palate offers mature yellow apple and candied citrus slice alongside crisp acidity. KERIN O’KEEFE;87;Tenuta Sant'Anna NV Extra Dry (Valdobbiadene Prosecco Superiore);$15;Extra Dry;Glera, Italian White;Valdobbiadene Prosecco Superiore, Veneto, Italy;Tenuta Sant'Anna;KERIN O’KEEFE;11%;750 ml;Sparkling;Montcalm Wine Importers;1/1/2020
Aromas of dark-skinned berry and eucalyptus form the nose. On the succulent, easygoing palate, soft tannins accompany mature black cherry and blackberry along with a touch of rhubarb. Enjoy soon. KERIN O’KEEFE;87;Stemmari 2017 Estate Grown Pinot Noir (Sicilia);$11;Estate Grown;Pinot Noir;Sicilia, Sicily & Sardinia, Italy;Stemmari;KERIN O’KEEFE;13%;750 ml;Red;Prestige Wine Imports Corp;1/1/2020
